Оценка;Отзыв
5;Запах у этой маски просто невероятный. В использовании очень удобная, закрывает все участки. После использования маски кожа очень напитанная, прямо чувствуется увлажнение. Анти-эйдж эффект и дренажное действие конечно же невозможно проследить после 1 применения, но маска очень понравилась и я ее обязательно повторю
5;Любимая альгинатная маска для лица. После ее использования кожа подтянутая, увлажненная, смягченная, напитанная. Делаю ее на ночь, а утром лицо просто персик)) Рекомендую всем подружкам и сама буду покупать не раз))
5;"У меня настала горячая пора и времени на уход за собой катастрофически не хватает. Вообще Sad
А быть ухоженной и красивой хочется всегда, да и запускать себя - ещё больше потом проблем с восстановлением.
В общем сейчас я в поиске действенных баночек и тюбиков и чтобы времени на нанесение, ожидание впитывания и прочих процессов было как можно меньше. Ища в интернете что-нибудь новое и бюджетное, ..."
5;Отличная маска! Очень приятная по текстуре. По консистенции, чем то похожа на сыворотку постактиватор из обычных масок этой серии. Замечательно наносится и распределяется ровным слоем. Имеет приятный запах, в котором присутствуют тонкие нотки мандарина. После нанесения на лице очень приятные ощущения, чувствуется как кожа насыщается витаминным комплексом, присутствует приятное покалывание. Маску н...
5;Несмотря на возраст (38 лет) у меня нет больших проблем с кожей, нет морщин, даже мимических, поэтому оценить свойства маски в этом направлении не могу. А вот успокаивающий эффект прекрасный, к тому же хорошо вычищаются поры и увлажняется кожа. Я использовала одну упаковку дважды. После первого раза поместила ткань обратно в пакетик, все крепко завернула и положила в холодильник.
5;"Долгое время  я искала маску, которая действительно работает. и ура, я ее нашла. 
первое, что хотелось бы отметить- маска хорошо напитана. имеет очень приятный аромат.
конечно с первого применения она Вам черные точки не удалит, но значительно уменьшит их количество. 
1. поры сужает!
2. освежает кожу!
3. увлажняет!
4. матирует! 
5. не оставляет после себя неприятное ощущение! (жирный блин ..."
4;Очень понравилась эта маска, такого эффекта увлажнения не получала  ни от одной испробованных масок, единственный ньюанс - это то, что процедуру надо делать только лежа, иначе маска сползет
5;"Про эту маску почти ничего сказать не могу, брала на подарок... Но девочка, которой дарила, осталась очень довольна! Себе я брала другие маски из этой же серии - хорошие, понравились! 
Хватает на несколько применений. 
Очень милый наборчик, для небольшого комплимента в качестве знака внимания - самое то!"
5;Стандартная тканевая маска, после использования кожа чистая и нежная. Цвет лица не улучшился, но глупо было бы ждать этого от одной маски. На один раз очень даже ничего
5;"Лёгкая приятная  масочка, хорошо пропитанная. Кожа после использования приятно увлажнённая, чувствуется упругость, для сухой и чувствительной кожи полезное баловство!
 Маску не нужно смывать, перед применением я держала её в холодильнике. Немного несуразное лекало, но и маска то бюджетная)))"
5;Хорошая маска! Однозначно рекомендую, действительно, успокаивает, увлажняет. Применяю ее несколько раз в неделю, очень нравится, особенно после пилинга хорошо работает.
5;Маска классная, увлажняет, питает, кожа после маски немного светлеет, бархатная и гладкая стала. Про упругость кожи пока не поняла, но буду ждать этого продолжая ей пользоваться.
4;"Хорошая маска розового цвета с блёстками , очень приятная и красивая . По консистенции немного напоминает желе. 
Запах очень фруктовый , и очень приятный . 
Наношу на чистую кожу лица тонким слоем на 20 минут , она не стекает, держится прекрасно! 
После применения кожа как у младенца .
От морщин она вас точно не избавит, но хорошо увлажнит лицо ."
4;Маленькая упаковка,хватает на меньше раз чем написано,но зато действенный))
5;Маска нежная. Мне понравилось что она не только ухаживает за кожей но и убирает отечность. По крайней мере на меня так подействовало. А отечностью век я очень страдаю. Приятный запах и легкая текстура.
5;Данная маска во-видимому является аналогом знаменитых Глем Глоу, использовала ее несколько раз, но толку так и не увидела. Возможно, чуть подсушивает кожу, но так делают все маски. Единственный плюс - цвет типа фольги, наверно больше подойдет для инста-фотографий
5;Очень люблю увлажняющие молочные маски наподобие этой, до этого пользовалась молочной маской от Tony Moly. Очень хорошо увлажняет, прямо чувствуется как кожа напитана. Также после данной маски она очень мягкая и бархатная, для лучшего эффекта рекомендую наносить на вечер и подольше
5;Добротная маска, действительно увлажняет кожу
1;Попробовала эту маску по совету подруги и что могу сказать. Наносила на очищенные и распаренные поры, держала около 10 минут, затем убирала с лица и ополаскивала проточной прохладной водой. Использовала ее курсом, но эффекта так и не заметила( Эта маска совершенно не очищает поры и не вытягивает из них грязь.
5;Маска альгинатная в виде белого порошка упакована в прозрачный пакет который находится внутри этой коробки. Развожу ее водой на глаз, так как в первый раз разводила мерными ложками как написано на упаковке и она получилась густая неоднородная не успела я ее размешать как она уже почти застыла а схватывается она моментально, пришлось выбросить и делать уже по интуиции на глаз развожу до консистенци...
5;Как всегда белорусский производитель радует! Соотношение цена-качество радует. Маска белого цвета, с вкраплением мелких скрабирующих частиц. Запах кремовый, немного с отдушкой как у мужской косметики (не критично, я так понимаю что вся серия так пахнет). Наношу на чуть влажную кожу после уходовых процедур, в т.ч. после саморазогревающейся маски из этой линии, по инструкции. Кожа после применения г...
5;Очень и очень деликатный, но работающий пилинг для лица. Это мой первый пилинг с кислотами и я очень довольна. Пользуюсь уже несколько месяцев, он, действительно, выравнивает тон кожи, немного осветляет кожу. Держала на коже и более 5 минут(просто забыла), но никаких раздражения на коже не увидела. Однозначно всем рекомендую!
5;"Сразу скажу, данная маска совсем не впечатлила. 
И так, сама маска находится в солидном и добротном тюбике, с откручивающейся крышкой. Вы глядит дорого. Консистенция маски: очень густая, отлично распределяется по коже. После нанесения на моей коже чувствовалось легкое сжение. Скорее всего, маска мне просто не подошла либо аллергия на какой-то из компонентов. 
Не могу сказать о плюсах этой маски..."
5;Любимая маска от  Белиты с эффектом скраба. Очень вкусный аромат сухих сливок и немного пыльной розы. Упаковка добротная, приятно держать в руках. Маску наношу на кожу после умывания, немного массирую и держу минут 10-15, после протираю тоником. Эффект отличный.  Лицо заметно свежее, кожа более ровная, увлажнена, и  если она не сухая а нормальна, то кремом я не пользуюсь.  Не вызывает раздражений ...
5;Понравилась маска, и правда холодит слегка. Вообще к не смываемым маскам не очень хорошо отношусь, но тут приятно удивилась, что не захотелось бежать умываться. Лицо свеженькое после использования. Однозначно рекомендую.
5;Понравилась. Как и заявлено, заметно подтягивает кожу, омолаживает, оздоравливает. Я довольна. А к керамидам с биозолотом я вообще тяготею.... эффект потрясающий! Спасибо производителю!
5;Не важно что в аннотации он женский. Мне очень понравился. С моей кожей склонной к раздражениям и прыщам почти в 40 лет подошел. Покупал еще когда на упаковке было написано Мишель лаборатрори.
4;Не плохая масочка! Запах довольно интересный, но приятный. По мере перемешивания порошка с водой, запах не исчезает, но на лице, после застывания маски аромат уже не чувствуется. Сама маска порошкообразная (как и все альгинатные маски), похожа на зелёную глину. Смешивать этот порошок нужно с холодной водой. Пропорции все подробно расписаны на упаковке. В итоге должна получится консистенция густой ...
5;Здравствуйте можно ли использовать в качестве крема ежедневно. И какой срок годности после вскрытия баночки
5;Такая классная! Такое приятное тепло по лицу, реально как будто теплое полотенце! Никаких неприятных ощущений от маски я не получила, не щипало кожу. Поры очистились. Однозначно рекомендую! Соотношение цена-качество фантастика!
5;Маска потрясающая. У меня комбинированная кожа и после использования маски она выглядела великолепно. Выравнивает тон кожи, лицо выглядит здоровым и сияющим. Очень удобное лекало, маска идеально прилегает и никуда не сползает.
5;Покупала маску вместе с кремом из данной серии. Маска хорошо увлажняет кожу, мелкие морщинки становятся менее заметными, улучшается цвет лица и кожа становится более упругой. Рекомендую!
5;Нравятся тканевые маски Гарнье. Очень удобно, когда срочно нужно выглядеть свежо!
5;"Хорошая маска: интересная идея с дизайном и исполнением; удобно распределяется по всему лицу; сама маска хорошо пропитана эссенцией; увлажняет, питает, придает здоровый блеск коже,  если из холодильника,то снимает отечность и припухлость лица. Вот относительно основного назначения-осветления ничего сказать не могу, так как нет надобности."
5;Маска работает по принципу поверхностного химического пилинга. Вначале ощущается небольшое пощипывание за счет работы АНА кислот. Результат виден после первого применения. Кожу не сушит. Хороший, более детальный уход за смешные деньги.
5;Интересная маска) Густая, сероватая, на лице полупрозрачная. Действие именно такое, как заявлено - стягивает поры! Засыхает полностью, действует как яичный белок, т.е. образует плёнку, которая стягивает кожу. Тонизирование от неё тоже есть. Мне понравилась!
5;Очередной раз убеждаюсь, что маски Holika Holika в своем ценовом сегменте самые крутые и выполняют заявленные функции. Покупку повторю однозначно! И думаю не раз! В избранном у меня уже лежат подобные маски для будущих заказов) Все больше нравится магазин и сервис. Я и забыла, когда последний раз ходила в магазин пешком))))
5;Супер маска!!кремовой консистенции,причтно наносить на лицо,маска не высыхает и на стягивает кожу,после использования кожа напитанная,увлажнённая,ухоженная.мягкая,цвет лица выравнивается.очень рекомендую!куплю ещё не раз!
5;Я была в восторге от одной подачи этой маски. Маска-тряпочка пропитана каким-то составом, который при контакте с кожей начинает пениться. Пара минут- и все лицо в пене. Очень необычно, честно скажу, хотя, многие наверняка слышали и пользовались корейскими пузырьковыми масками. Что касается действия, то тут особо отметить ничего не могу, но порцию радости в процессе вы обязательно получите:)
4;"Маска очень эффективная, всегда имею в арсенале. Как sos-средство использую точечно на воспаления на ночь. Если использовать маску на все лицо, хорошо осветляет черные точки и выравнивает тон кожи, матирует и делает кожу бархатистой. При чем результат заметен сразу.  Жирная и комби кожа оценят. 
Единственный минус- быстро портится (этим грешат все средства Green Mama) и запах не очень приятный."
5;Маска понравилась ! Отличная скорая помощь для быстрого улучшения состояния своей кожи. Цвет лица улучшается, мелкие морщинки разглаживаются, тон становится более ровнее. Закажу ее еще раз.
5;Представляет собой голубо-зеленый порошок, который необходимо развести водой, до консистенции сметаны, порошка 30 гр. мне полноценно хватило на 3 применения  для лица и шеи. При нанесении маски на лице образуется, пленка очень похожа на резиновую, не растворяется водой ,которую потом необходимо удалить. Если маску передержать то она засыхает  и начинает шелушиться , в следствии чего трудно удалять...
5;Классная тканевая маска. После ее применения кожа гладкая увлаженная.
5;Маска очень плотная и густая, с отвратительным запахом. После применения на лице оставалась жирная пленка и не приятные ощущения. Никаких эффектов после маски не заметила. Не использовав и половину тюбика выкинула. Напрасная трата денег.
5;Маска хорошая, повторю, кожа после нее мягкая, бархатная, кожа после первого применения конечно же не станет упругой и подтянутой, но эффект мне понравился, хочу попробовать и другие маски из этой серии
4;Слегка выравнивает цвет лица, но без чудес.
4;Маска действительно освежает. Кожа гладкая, бархатистая. Аромата никакого нет, ну если только легкий косметический. Эффект длится недолго. Держала 20 минут. После снятия ткани, маска быстро впиталась. Я обычно не разглаживаю. Есть в наличии еще маски этой серии. Буду тестировать, надеясь на лучший результат.
5;Эта маска отлично подходит для жирной и комбинированной кожи. Она неплохо сужает и очищает поры, делает кожу матовой и более здоровой на вид. Маска также помогает осветлить пятна после прыщей, подсушить воспаления и способствует их быстрому заживлению. Кожа после неё заметно меньше жирниться, благодаря чему воспаления беспокоят намного реже.
5;"Эта маска имеет сухую текстуру в виде сероватого порошка. Его необходимо размешать с водой до получении удобной для нанесения консистенции. Через несколько минут после нанесения маска начинает высыхать, как это делают глиняные маски. Я бы рекомендовала периодически увлажнять маску водой из распылителя, чтобы не высушить кожу. 
Кожа после использования данной маски становится матовой, посвежевшей ..."
4;Маска в целом не плоха. Но очень уж жидкая, впитывается долго. Эффект держится дня 2. Кожа щелковая, гладкая как у младенца, напитанная, подтянутая и увлажненная. За эти деньги достаточно.
5;Маска оправдала все ожидания. Лицо стало свежее подтянутое и отдохнувшее. Она мне очень понравилась. Мгновенный результат.
5;"Минусов при использовании маски не нашла, одни положительные эмоции - увлажнение, тонизирование, отбеливание. 
Маска не вызывает отеков и раздражения. Её можно и нужно использовать перед мероприятием, а также накануне, ибо она обеспечивает сияющий внешний вид!
Любите себя!"
5;Пользовалась крем-маской уже два раза. Пятна на лице становятся светлее, лицо начинает преображаться. Маска пощипывает. Надеюсь, что этот продукт как-нибудь повлияет и на рубчики.
