Оценка;Отзыв
5;Продукт интересный) купила именно из-за необычного применения - нанести, поводить магнитом. Маска довольно питательная, ощущения от массажа магнитом интересные и очень приятные) рекомендую к покупке как необычный в использовании продукт.
5;Продукт однозначно понравился. Консистенция тяжелая, питательная. После нанесения - кожа довольно жирная, но минут за 15-20 впитывается. Запах необычный (не похоже на что-то парфюмерное, скорее запах эфирных масел), но приятный. Честно говоря, не ожидала чуда, использовала каждый вечер в течение недели, т.к. очень хотелось быстрого результата. Была приятно удивлена тому, что маска отрабатывает на ...
4;Запах очень приятный, что то такое свежее, напоминает сок красного винограда. Консистенция голевая, приятная, распределяется хорошо. После применения маски кожа увлажнённая, напитанная на ощупь. Маска понравилась, но, к сожалению мне не подошла - с первого применения на коже было раздражение от неё, что несвойственно моей коже.
5;"Очень милый дизайн с хрюшкой! Упаковка привлекает)
Текстура маски густая, чёрного цвета, похожа на смолу.
Лучше наносить на влажную кожу. Когда она уже подсохнет, нужно смочить и слегка помассировать- она начнёт немного пузыриться) 
Приятный, парфюмированный аромат. Хорошо 
подойдет для жирной и проблемной кожи, потому что воспаления и прыщики отлично подсушиваются! Поры очищаются и сужаются, ..."
5;"Хорошая маска. Она действительно работает и подсушивает прыщики 
Смывать ее не очень удобно - но если взять спонж или просто салфетку то более менее."
5;Маска представляет из себя прозрачный гель, буквально набитый сверкающими частичками. Очень приятно выглядит, легко наносится, частички никак себя не проявляют, кожу не царапают, хорошо смываются, в общем, просто чисто декоративное добавление. Маска действительно очень хорошо увлажняет, омоложения и сияния не заметила. Мне маска понравилась, советую.
5;Маска очень классная.
5;Хорошее средство! В условиях проживания в городе, не всегда бывает возможность сходить в баню/сауну , а для кожи такое прогревание отличное средство, для очищения пор. Поэтому я решила попробовать это средство, но! Такого же эффекта все равно нет. Для разнообразия очищения кожи, очень даже хорошо. Консистенция    в меру густая, запах острый, в составе есть перец. Соответственно для чувствительной ...
5;"Брала несколько альгинатных масок этого производителя в качестве пробников.
Даёт отличный увлажняющий эффект, так же немного осветляет воспления.
При правильном разведении имеет плотную консистенцию, но самостоятельно наносить на лицо довольно сложно.
В целом хороший продукт, буду брать полноразмерную версию в баночке."
5;Эта маска призвана не только освежить уставшую кожу, но и рассмешить домочадцев. Когда вы разворачиваете саму маску, на ткань нанесен рисунок в виде мордочки панды - муж мой сильно смеялся. Ну что сказать, это мило. Если вы готовы переплачивать за такой мимимишный эффект, то такая маска вам отлично подойдет. Возможно вы хотите устроить пати и нафоткаться в этих зверомасках) Но эффект у нее самый о...
5;Ах, этот аромат. Маски из этой серии, не только банановая, все они имеют яркий прекрасный аромат, из-за этого маска превращается в спа уход для лица. Эффект от маски тоже очень положительный. С кожи стираются следы усталости, кожа кажется более ровной, нежной на ощупь. Огромный плюс, что состав маски не нужно смывать. Лекало у масочки удобное, впрочем как и у всех корейских масок. Ткань тоненькая...
5;"Моя первая альгинатная маска.
Если хотите познакомиться с таким видом масок - смело советую эту! 
-Пакетик рассчитан на 1 раз, если растянете его на 2 раза, того эффекта, который должен быть от альгинатной маски не будет. Почему? Да потому, что альгинатная маска работает за счет толстого, плотного слоя. Да и снимается тогда она легче,  один пластом, нежели если вы ее нанесете тонким слоем.
-Пор..."
5;Очень поднимает настроение! Звездочки по всему лицу, словно галактика! Сохнет правда долго, но пока делаешь селфи - высохнет еще и как. Побаловаться с подружками можно. Очищение не особо заметное, а настроение на высоте. Маска для тех, кто хочет разнообразить свои фоточки в ленте.
5;"Маска действительно сужает поры, но и подсушивает кожу хорошо, даже в некоторых местах мне пересушила. Лекало хорошо пропитано, но или у меня лицо маленькое, или так задумано было) Нижняя часть еще и на подбородок налаживается, мне пол шеи закрыло)
Сам эффект от маски хороший, но вот только возле глаз, где попадала маска - пересохла после кожа, и стала шелушиться."
5;Классная маска!Очень хорошая и действенная.Не похожа на обычные тканевые маски. Дизайн дорогой и интересный, лекало широкое на первый взгляд, но ложится очень хорошо, для глаз и рта отличные удобные прорези, везде подрезана где надо, идеально садится - ткань плотный хлопок, пропитки не много, она не льется. Из минусов маска быстро высыхает - через 20 минут полностью сухая тряпочка на лице. Липнет ...
5;Волшебная маска,уже не первый раз беру.Каждый раз удивляюсь супер натуральным ингредиентам, бренд Teana действительно в себя влюбляет.Кожа нежная и мягкая,а я абсолютно счастливая! Ещё недавно попробовала их новинку-маску-смузи,тоже бомба!Эффект просто обалденный,настолько натуральная,что её даже можно съесть!Всем очень советую!
4;Маска средненькая скажем так. не могу сказать, что абсолютно бесполезная, но и хорошего увлажнения я от нее не получила. Так ... баловство одним словом. Состав хороший, но на моей коже он почему-то не работает. Она у меня уже почти закончилась. Вот добью и больше не куплю
5;Отличный скраб, наверное самый удачный скраб для лица, который я пробовала в белорусской косметике. Консистенция густая кремовая с вкраплениями очень мелких скрабирующих частичек, а также гранулками,  которые при массаже растворяются и придают маске желтый цвет. Запах немного лекарственный (медицинский), сама маска помимо скраба еще немного напоминает глинянную маску. Я пользуюсь ей с удовольствие...
4;"Я заказала 3 разных маски из серии Beauty Visage и это наверное самая плохая из это серии. Но сразу оговорюсь, это потому что две другие просто ооооочень крутые. 
Лекало у всех одинаковое и довольно удобное. Нет навязчивого запаха, что тоже плюс для меня. Сама маска пропитана довольно хорошо.
Теперь об эффекте. Какого-то ВАЙУ эффекта я не увидела и не омолодилась))) Даже маленькие морщинки на лб..."
5;"Очень понравилась маска. Идеальна для глубокого увлажнения кожи.
Красивого розового цвета. Кремовой консистенции. Приятно ненавязчиво пахнет. Очень хорошо увлажняет, делает кожу нежной, упругой, освежает, придает здоровый вид, убирает все шелушения. Не сушит. Легко смывается. 
Объем небольшой, но хватает маски на несколько раз. 
Упаковка красиво смотрится. Можно и подарить кому-нибудь.
Покупку..."
4;"На твердую четверку.
У меня сухая кожа и я уже долго ищу маску ,которая за один раз раз бы увлажняла мою кожу.Эта ,конечно,увлажнила и мне даже хватило того,чтобы потом обмакнуть лекало в эту консистенцию и использовать второй раз.
Но 4 за то,что мне не хватило увлажнения.Возможно,это только мои предпочтения,поэтому все же посоветую её к покупке.Запах приятный.
Из заявленных достоинств не могу ..."
5;"Очень приятная масочка. Понравился эффект от нее. 
Она имеет кремовую консистенцию, поэтому легко наносится на кожу и не застывает коркой как обычная глина. Очень удобно, что ничего не нужно смешивать. Легко потом смывается теплой водой. Не сушит кожу. Выравнивает цвет лица, матируюет и немного осветляет. Насчёт омоложения не знаю, пользовалась только несколько раз. Но вид более свежий однозначно..."
5;Очень хорошая маска! Мне хватило на 2 раза, а если учитывать рекомендации производителя наносить массажными движениями, то хватит и на 3 раза. Держала 10 минут, не стоит держать дольше, иначе придётся смывать очень долго с лица. Маска приятная, полупрозрачная, с приятным ароматом, по консистенции похожа перемолотый алоэ+желе. После применения кожа увлажнена, смягчена, небольшие покраснения устране...
5;Масочка рабочая. Консистенция странноватая-простоквашки. Легко наносится, также хорошо смывается с кожи. Для моей комбинированной и проблемной коди с возникающими воспалениями она незаменима. Отлично матирует. Эффекта от нее хватает мне до 4-5 дней. Регулирует работу сальных желез. Это заметно.
5;"Интересная идея: маска-основа, которая меняет свойства при добавлении того или иного ингредиента. Мне больше всего понравились варианты с лимонным соком и сахаром.
Также я добавляю к маске ложку кокосового масла для питания, ложку масла черного тмина от высыпаний, соду - чтобы получить маску-пилинг, тыквенную кашицу и яблочный уксус для питания."
5;Отличная питательная маска для лица! Консистенция густая с небольшими частичками. Запах очень приятный, пользуюсь с удовольствием! После использования кожа мягкая и напитанная. Советую к покупке.
4;Хорошая маска, выполняет все обещания производителя. В упаковке находится 12 кружочков в виде зеленых огурчиков, как показано на упаковке, кружочки разного диаметра, можно использовать на любую часть тела, пахнут кружочки огурцом не навязчиво. Я использовала на лицо после хранения в холодильнике - мне хватило маски на 2 раза. В этом и плюс и минус этой маски - с одной стороны можно 2 раза  использ...
5;Классная маска, отлично убирает покраснения и увлажняет, освежает. Буду брать еще!
5;Отличное средство! Пузырится и очищает кожу, очень понравилось. Объем не большой, но расход тоже не огромный. Удобно взять с собой, упаковка отличная!
5;У меня комби кожа. Взяла первый раз эту маску. Наносила после умывания и очищения кожи тоником. Лекало маски удобное, пропитана хорошо. Поры после нее действительно стали значительно меньше. Но на следующий день уже вернулись в свое обычное состояние. Поэтому для более длительного результата использовать ее нужно несколько раз в неделю. После маски кожа матовая и увлажненная. Кремом после не польз...
5;Маска очень понравилась, после применения долгое время сохраняется эффект салонного ухода. Цена и качество очень порадовали, буду заказывать еще.
5;Время от времени покупаю маски-пленки, чередую их с гелевыми и тканевыми. Расходуются они у меня быстро, неважно какой объем, потому что наношу плотным толстым слоем. После высыхания толстый слой снимается легче, и не кусками, а цельным полотном. Привыкла к пленка настолько, что хотя бы раз в неделю мне надо использовать ее. Кожа после них становится идеально матовой. И на этот раз среди прочих вы...
4;"Маска пахнет сладким миндалём.
Храню в холодильнике, поэтому приятно холодит и довольно сложно наносится. Обычная кисточка для маски не подойдёт.
Текстура маслянистая, но в процессе на коже засыхает и стягивает.
Смыть без спонжей нереально. Очень маслянистая, и сильно уходит в поры.
Но эффект приятный. Лицо главное, чистое. 
Более ровный тон и мягкость.
Думаю, в процессе лучше сбрызнуть лицо..."
5;Попробовав раз корейские тканевые маски, я не смогла остановиться на одной-двух. Мне нужно было все перепробовать. Увидев маску с экстрактом картофеля, мне даже интересно стала. Вау, как интересно! - подумала я. Нужно же попробовать все ароматы, вкусы и оттенки. Алоэ и огурцами в качестве маски никого не удивишь, а вот картофель - это что-то интересное и новенькое. Требования мои те же, что и к ос...
5;Давно мечтала попробовать маску с экстрактом зеленого чая. Наслышана о его чудодейственном эффекте. А тут такая удача и как не попробовать? Маску скрывает надежная упаковка. Имеет приятный аромат с нотками какой-то растительности. Маска хорошо пропитана, когда вынимаешь из упаковки жидкость не стекает. Размер лекало стандартный, не супер огромное полотно, которое покроется складками на вашем лице...
5;Маска хорошая, но высыхает быстрее чем 15 минут. После маски, уменьшаются покраснения.
5;"Хорошая увлажняющая маска, которая классно действует на коже!
-консистенция легкая, геле-кремовая)))
-подойдет для всех типов кожи
Если наносить тонким слоем - впитывается быстро, иногда даже использую как ночную маску, на утро кожа напитанная,увлажненная, цвет лица выравнен 
Если наносить слой побольше, то впитывается дольше, смываю спонжем, кожа тоже отлично напитана и увлажнена 
Советую..."
5;Маска очень приятная, густая. При нанисение  воспалений,красноты,аллергической реакции не вызывает. Запах приятный. Впитываеться Долго,но кожа после применения гладкая, мягкая,чувствуется напитанной. Хоть в инструкции написано что смывать не нужно,но кожа все равно липкая, я смываю.
5;Попробовала новинку, понравилась ни хуже других, что пробовала ранее. Маска отлично питает,  увлажняет и освежает кожу. Рекомендую, закажу еще!
5;Тканевая маска от holika holika имеет Хорошее удобное лекало, ткань очень тоненькая хорошо напитанная, по лицу хорошо распределяется и не съезжает. По эффекту похоже что охлаждает и успокаивает кожу. Использовала её после пилинга. Результат: увлажнённая, напитанная кожа, дискомфорта никакого не вызвала, но выравнивания тона не заметила( держала 30 минут, после не смывала, распределила остатки по л...
1;Совершенно бестолковая вещь. Лучше взять в банке корейские
2;"Не понравилась маска совсем((
Никакого эфекта не заметила и очень плохо снимается, кусками, какой бы толщины не наносила!
Нет этой маске точно и увы((
Хотя у меня была маска-пленка этого бренда из другой серии и тоже бюджетная, с черным углем, вот она классная!"
5;"Использую 
Или Утром подготавливает кожу к макияжу, убирает шелушинки 
Или Вечером хорошо очищает, дарит ощущение чистоты на лице 
Состав хороший
Аромат приятный, но резкий
Все, что заявлено, выполняет
Когда подсыхает, нет ужасного чувства стянутости 
СОВЕТУЮ! попробуйте ОБЯЗАТЕЛЬНО!"
5;Тканевые маски действительно дают накопительный эффект, если пользоваться ими регулярно или курсами, конечно, если речь идет о качественных. В моем городе корейская косметика  недоступна, мне приходится либо в других городах закупаться ими впрок, либо заказывать в интернет-магазине. В косметическом магазине эту маску я купила примерно за такую же цену. Цена, я бы сказала, демократичная. Корейскую ...
