Оценка;Отзыв
5;Взяла на пробу две гидрогелевые маски, эту и другую из серии, синюю, с агавой. Обе очень понравились, хорошее, удобное лекало, хорошо увлажняют кожу, выравнивают тон лица. Сыворотка после того, как убираю маску, хорошо впитывается, не оставляет на лице противной липкости. В общем, хорошие продукты, очень понравились, довольна покупкой, советую
5;Впервые попробовала гидрогелевую маску для лица, обычно такими бывают только патчи. Лекало плотное и очень хорошо обхватывает лицо, тем не менее, я всегда лежу, когда наношу маску на лицо, ибо законы гравитации работают против нас. Отлично увлажняет кожу, немного осветляет, охлаждающий эффект действительно есть, но он несильный
5;Это лучшая маска из тех, которые я попробовала. Идеально подошла моей коже. Аллергической реакции не вызвала. Здорово напитала мою кожу, в составе есть гиалуроновая кислота и муцион улитки, который помогает коже не увядать,подтягивает контур лица. Отличное лекало, хорошо пропитанное, остатки нанесла на кожу. Запах присутствует нежный, мягкий, ненавязчивый. Качественная, достойная упаковка. Пришло ...
3;По идее маска должна намертво прилипнуть к лицу и отлипнуть только вместе с черными точками, но этого не происходит. Запах лимонный (зачем?), особо не сушит, весьма приятная, на том спасибо. От одежды не отмывается. Короче зачем эта маска существует не очень понятно)) объем, кстати, очень мелкий, это тоже хорошо, не жалко выкинуть наполовину использованной
5;Хорошая, увлажняющая маска. Но большего эффекта от нее ждать не стоит.
5;Попробовала маску. Приятная, питательная, увлажняет отлично. После её использования чувствуется свежесть. Не могу не отметить, что моим детям очень понравился дизайн, весёленький и очень оригинальный. Рекомендую
5;Очень приятная маска, лицо после неё сияющее, кожа гладкая и нежная! Плюс приятный аромат!
5;Маска создаёт лёгкий охлаждающий эффект, однозначно очищает поры. А также я заметила что кожа лица стала более подтянутой.
5;Отличная маска!У меня комби кожа,после применения кожа стала чище,подтянулась,воспаления ушли.В течении дня меньше кожа блестела,мне понравилась,советую!
5;"Буквально на днях использовала эту маску. Что я скажу - маска вполне неплохая, но не 10/10 . 
Из минусов: липкий и слишком жирный финиш на лице. 
Из плюсов: очень, ОЧЕНЬ увлажняет кожу, тканевая основа очень хорошего качества, как вторая кожа ощущается - тонкая и нежная. Также я заметила, что кожа действительно как-то успокоилась (у меня она проблемная) и смягчилась. 
Я спользовала тканевую маску ..."
5;"Добрый день!
Качественный продукт с отличными свойствами. Ну доставка как всегда не подвела. Приятная, цветная упаковка.
В составе маски есть мед: отличное, пропитанное лекало, держала где-то полчаса, кожа напитанная, увлажненная и матовая после применения. А она у меня супер сухая. Указанные свойства подтверждаю. Еле-еле уловимый запах прусутствует. Аллергической реакции не вызвала. Цена была со ..."
5;После использования маски кожа гладкая, пропало покраснение, и даже сузились поры. Ещё я определенно чувствую увлажненность, а не жирность. Т-зона меньше блестит, и конечно же, лучше ложится тональная основа. Да, это определенно то, что нужно коже в любой сезон.
5;Результат меня удивил, я ничего особо не ждала. Кожа стала матовая, напитана, мелкие морщины исчезли, появился ровный, здоровый тон. Поры стали визуально меньше. Кожа стала выглядеть ухоженнее. Липкости нет. Раздражения не вызвала, высыпаний тоже. В процессе использования маски неприятных ощущений не было.
5;Бентонитовая глина вместе  с  куркумой,  маслом чайного  дерева отлично и  основательно очищают  поры кожи лица,   тщательно  удаляют  и очищают клетки, обладая  при этом антибактериальным  действием,  а  мята с ромашкой и  огурцом освежают, бодрят кожу.  Глина  сама по себе обладает свойствами не  только  очищать, но  и питать, так  как она насыщена  микроэлементами и  витаминами. Очень полезная ...
5;Крутая увлажнающая маска! Легко наносится, имеет приятную отдушку, на вид гелевой консистенции. После смывания кожа бархатная, напитанная и эффект держится несколько дней. Очень довольна покупкой!
4;"Очень люблю натуральную косметику и данный бренд очень люблю за его экологичность)
Насыщенный и натуральный запах лаванды. Использую ее на постоянной основе т.к. эффект не моментальный, а накопительный."
5;Все пришло в целости и сохранности, белорис огромный плюс вам за доставку, за упаковку, ничего не разбивается, прям упаковываете все круто! Что касаемо маски, то внешне очень мило выглядят, как на деле не знаю, брала в подарок, как девочка попробует, обязательно дополню отзыв.
5;Очень поравилась маска! Использовала ее накануне фотосессии. Кожа лица приобрела прекрасный вид. Стала увлажненная и сияющая здоровьем. Так как не было никаких особых проблем, то не могу сказать о воздействии на них. Буду рать еще.
5;Небольшие воспаления маска подсушивает. Кожа после нее становится увлажненная и мягкая.
5;В принципе неплохая маска. Радикально черный цвет, свежий запах, очень приятная консистенция. Ярковыразженный тепловой эффект, первые минуты кожа прям горит, и это очень классно! Не особо заметила эффекта сужения пор, но кожа потом все равно себя очень хорошо чувствует. Единственное, ее бывает сложно смывать, и если недостаточно хорошо очистить кожу, то маска останется в порах. Ну, чернющая маска ...
5;Мвска серого цвета, мягкая, легко наносится. Полностью не высыхает, светлеет, но остаётся пластичной. На мой взгляд, смачивания не требует. Отлично очищает, сужает поры, снимает воспаления. Одна из лучших очищающих масок! Кожу не сушит, раздражения не вызывает. Советую!
5;Маска средней плотности, белого цвета, с легким цветочным ароматом, который довольно долго держится на коже после смывания. При нанесении чувствуются масла, ощущение после нанесения очень приятное. Я хожу с ней не меньше 30 минут, маска почти вся впитывается, остаётся только немного масла, которое смываю тёплой водой. Кожа после неё очень мягкая, шелковая. Отлично смягчает и питает кожу, советую.
3;Я никогда не пользовплась тканевыми масками для лица. Вероятно пришла пора. Прочитав состав и информацию о даннлм продукте, я решила ее заказать, мне 45, поэтому антивозрастной такой уход, думаю будет кстати. Надеюсь булет отлично!)
5;Просто отличная пенка. Чаще использую как маску - эффект нравится больше.
5;Супе маска. Освежает, увлажняет, успокаивает. Мне очень нравится
5;Очень нравится эта масочка! Сама ткань маски очень тоненькая, хорошо ложится на лицо. Лекало удобное, я его только разрезаю на переносице, чтобы удобнее легла на нос и около глаз. Много жидкости. Мне на два раза хватает. Только во второй раз я наношу жидкость уже без маски. Маска тканевая расположена на подложке( видно на фото). Мне нравится , что кожа после нее увлажнена, выровнена. Советую!
5;Маска увлажняет кожу лица, не сказала бы, что пахнет супер, но все другое выполнено на ура. Маска удобна в использовании. Явно у меня в фаворитах.
5;Очень понравилась маска. Ощущения приятные. Сама по себе самая средняя, но поиграться иногда можно)
5;Маски этой серии мне пришлись по душе.У них хорошая пропитка и  лекалло. Маска хорошо увлажняет ,питает придает коже здоровый вид,упругость и элостичность.Не сползает, слегка подтягивает кожу.
5;Просто обожаю такие маски. Отлично увлажняет кожу,улутшает цвет лица.Раздражения не вызвало. Одного пакета мне хватает на лицо,шею и декольте.Наношу на очишенную кожу за час перед сном не смываю.
5;Покупала за 53 рубля. Хорошая цена и маска хорошая. Очень сильно пропитана средством. Лекало нормальное. Аромат не яркий. Увлажняет кожу лица и шеи. Мне нравятся масочки этой серии.
5;Очень нежная консистенция. Лёгкая, не плотная. Быстро впитывается, не оставляет на коже пленку. Экономичный расход. Лифтинг эффект заметен сразу после первого применения.
5;Хорошая маска. Материал приятный, плотный, мягкий, чёрного цвета. Пропитана отлично, сыворотки внутри очень много,это как раз тот случай, когда можно в упаковку опустить прессованную таблетку(основу для маски) и получить ещё одну полноценную маску. Держать нужно 15- 20 минут, я оставила на полчаса и когда снимала, маска все ещё не была сухой. Кожу напитала, мелкие морщинки разгладила, цвет лица вы...
5;Крутая масочка. Бюджетная находка. Хорошее лекало, отлично взаимодействует с кожей. Лицо после неё гладкое, нежное мягкое.
5;"Отличная ночная маска. Не пугайтесь лова маска, по сути это ночной крем. Имеет такую жеконсистенцию как и крем. Ни сколько не утяжеляет кожу. Наносить нужно за 30 минут до сна, следов на подушке не оставляет. Хорошо успокаивает и увлажняет кожу лица.
Для сухой кожи подходит идеально."
5;Маска приятная. Аромат парфюмерный, нежный. Покупала за 40 с небольшим рублей. Жидкость прозрачная и ее много. Хватает ещё и руки и шею. Липкости нет. Кожа после применения нежная и напитаная. Смывать не нужно. Лекало вполне удобное. Советую.
5;Маска желеобразной консистенции, приятная, холода не заметила, но кожа на утро очень приятная после нее. Упаковочки хватило на 4применения. Рекомендую.
5;Очень приятная масочка, много эссенции в упаковке, хватило и на шею, и зону декольте, и даже руки) не щипит, не жжёт, эссенция довольно склизкой консистенции, видимо из-за муцина улитки) после снятия маски распределила остатки лёгким массажем и подвбила пальчиками, поэтому быстро впиталось) сразу после офигенное ощущение на коже-снялось чувство стянутости после использования пилинга, лицо стало уп...
5;Маска с приятным запахом и прекрасно увлажняет сухую кожу
5;Хорошая увлажняющая маска
5;Маска липковатая, я ее смыла после использования. Очень увлажняющая, приятная,кожу напитывает, есть небольшой эффект охлаждения. Никаких реакций не было, но еще раз не возьму - смущает липкость.
5;Замечательная маска. Я удивлена ценой и качеством. Сама упаковка маски большая и яркая. Содержимого 36 мл. Это много девочки. Внутри тканевая маска находилась на подложке ( видно на фото). Сама ткань маски очень тонкая, лекало удобное. Аромат лёгкий растительный. После применения кожа нежная и напитанная влагой. Я сразу после применения положила себе в корзину ещё 3 шт. Супер, супер!!!!
5;Люблю маски этой фирмы. Мама довольна.
2;Есть серия этих кремов, ночная маска и дневной такой же. Полное разочарование для меня, после умывания и протирания тоником крем как скатывался так и скатывается на лице.Я и тоньше слоем пыталась наносить, и пенки для умывания меняла, бесполезно. Скатывается на лице кошмарно, как буд-то грязь, не рекомендую никому. Оценка самая низкая для продукта Лореаль. Достоинств не заметила, он не против морщ...
5;Удивлена, что у этой замечательной маски до сих пор нет отзывов! Я ее обожаю! заказываю сразу несколько штук. 1 пачку использую 2-3 раза, ибо количество сыворотки позволяет. Маска отличается от многих тканевых, и как мне кажется, в лучшую сторону. Во-первых, она тончайшая, просто как вторая кожа! Идеально ложится на лицо и повторяет все его контуры! Во-вторых, приятный аромат. В-третьих, маска нал...
5;Маска сначала удивила своим игрушечным размером, но после нанесения поняла, что расход экономичный и поэтому такой объем вполне оправдан. Лично мне наносить удобно пальцами,  поскольку маска представляет собой густой тягучий гель с нейтральным косметическим запахом. Аккуратно наношу на нос и подбородок. Втечение 15-20 минут  пленка высыхает, кожа немного стягивается. Снимать маску проблем не соста...
5;Покупала маску на сайте за 53 руб. Очень хорошая цена. Качество тоже отличное. Маска имеет удобное лекало и она очень сильно пропитана. На упаковке указано 30 мл. Хватило бы и на два раза. Но я так не делаю. Использую маску в один прием, как и положено. Остатки жидкости распределяю на руки и зону декольте. Ткать лекала не толстая. Кожа лица после маски хорошо увлажнена и напитана! Супер!
5;Маска классная! Увлажняет прекрасно. Но эффект не долговременный. На упаковке написано, что она с экстрактом кокоса. Поэтому я ее и взяла. Но она не пахнет кокосом. У маски просто приятный сладкий запах. После маски пощипывало лицо.  Не знаю, с чем это связано? Может просто совпадение.
5;Отличная питающая маска, интенсивная, не оставляет после себя ни одной шелушинки, объем огромный, хватит надолго. Использую также в качестве ночного крема.
3;"В последнее время очень часто, особенно в косметике встречаю понятие коллаген и гиалуроновая кислота. Мы, женщины, словно сумасшедшие начинаем скупать все подряд, где светяться эти слова.
Не удивительно, ведь коллаген - это то, что делает нашу кожу упругой, и чем старше мы становимся, тем ее в организме меньше, а значит, наша кожа теряет тонус и упругость. Это неудивительно, ведь коллаген присутст..."
5;Маска мне понравилась, быстро впитывается и не ощущается. Использую как ночной крем. Запах имеет немного специфический, химический что-ли, как и многие белорусские кремы. Консистенция густо-гелевая.
5;"Добрый день!
Масочка отличная. 
Красивая яркая упаковка, цена была со скидкой. Доставка тоже не подвела. 
Маска очень понравилась, аллергии не вызвала. Пахнет очень вкусно.... клубникой. Отлично напитала мою сухую кожу, эффект довольно таки долгий. Состав замечательный просто, на упаковке указан. Кожа мягкая, нежная и увлажненная. Мне хватило на 3 раза, считаю это минусом, так как герметичность ко..."
4;очень красивая упаковка, а в остальном в составе есть консерванты и алкоголь на втором месте. после использования на следующий день на коже присутствовало шелушение (другие новые продукты не использовались)
4;в составе присутствуют компоненты синтетического происхождения, после использования на лице не очень приятно ощущается, присутствует стянутость, как-будто невидимая пленка обволокла лицо, хочется умыться после нее.
4;Данную маску попробовала на лицо , очищенное и распаренное после бани. Аромат маски парфюмерный. Очень приятный. Что то прям повеяло из детства. Маска  пропитана хорошо. Но.... Меня крайне удивило лекало.... Оно не для человеческого лица)))) оно для лица инопланетянина)))). Ничего подобного раньше я не видела. Оно огромное  и в форме яйца. Сделала фото. Сами посмотрите. Ответствие для рта в итоге ...
5;Я полюбила эту масочку всем сердцем! Наношу ее после пилинг пэдов, т.к. кожа у меня чувствительная и краснеет после них. Маска освежает лицо, уберает раздражения и покраснения, выравнивает тон. Наношу тонким слоем на 20 минут после смываю и кожа чувствует себя отлично увлажненно и  без сухости.
