Оценка;Отзыв
5;Очень многие  маски - это хорошая  работа корейской косметологии.   Э кстракт   гамамелиса успокаивает на лице покраснения  ,  с двух раз  ,  щёки бледнеют  ,   лекарственный гриб   разглаживает кожу и не даёт сухого последствия после процедур.    Это отличные  сопутствующие товарищи для лечения  акне.
5;Отличная маска, рекомендую!
5;Отличная маска!
5;Почти без запаха, не раздражают кожу под глазами, хорошо убирают тёмные круги. Внешняя сторона тканевая, внутренняя - гидрогелевая. Хорошие патчи
5;Обод эти патчи. Не оставляют липкости, я не смываю остатки. Освежают кожу под глазами
3;Вообще не поняла эту маску. Запах похож на мужской парфюм. Какого то эффекта от применения не заметила.
5;Обалденная маска. Смягчает, выравниваниет, слегка осветляет. В инструкции написано, что можно не смывать, но сыворотка липкая, поэтому смываю прохладноц водой и наношу тонер и крем. Отличная серия по дням недели, как патчи, так и маски.
5;Патчи с одной стороны гелевые, с другой тканевые. Очень приятные, никакого раздражения не вызвали
5;Обожаю все 7 масок из этой серии. Беру не первый раз. В маске много пропитки, пахнет приятно, отлично тонизирует кожу.
5;Маска отлично справляется с заявленными функциями. Увлажняет, напитывает, разглаживает, регенерирует, дарит гладкость и эластичность. Кожа ухоженная и благодарная! Советую к приобретению.
5;Маска хорошая понравилась, запах приятный, хорошо увлажняет кожу лица.
5;хорошая, увлажняет, лекало отличное
5;Очень многие  маски - это хорошая  работа корейской косметологии.   Э кстракт   гамамелиса успокаивает на лице покраснения  ,  с двух раз  ,  щёки бледнеют  ,   лекарственный гриб   разглаживает кожу и не даёт сухого последствия после процедур.    Это отличные  сопутствующие товарищи для лечения  акне.
5;Отличная маска, рекомендую!
5;Отличная маска!
5;Почти без запаха, не раздражают кожу под глазами, хорошо убирают тёмные круги. Внешняя сторона тканевая, внутренняя - гидрогелевая. Хорошие патчи
5;Обод эти патчи. Не оставляют липкости, я не смываю остатки. Освежают кожу под глазами
3;Вообще не поняла эту маску. Запах похож на мужской парфюм. Какого то эффекта от применения не заметила.
5;Обалденная маска. Смягчает, выравниваниет, слегка осветляет. В инструкции написано, что можно не смывать, но сыворотка липкая, поэтому смываю прохладноц водой и наношу тонер и крем. Отличная серия по дням недели, как патчи, так и маски.
5;Патчи с одной стороны гелевые, с другой тканевые. Очень приятные, никакого раздражения не вызвали
5;Обожаю все 7 масок из этой серии. Беру не первый раз. В маске много пропитки, пахнет приятно, отлично тонизирует кожу.
5;Маска отлично справляется с заявленными функциями. Увлажняет, напитывает, разглаживает, регенерирует, дарит гладкость и эластичность. Кожа ухоженная и благодарная! Советую к приобретению.
5;Маска хорошая понравилась, запах приятный, хорошо увлажняет кожу лица.
5;хорошая, увлажняет, лекало отличное
5;шикарная приятная маска, увлажняет очень хорошо, разглаживает кожу
5;"Маска подтягивает овал лица, придает эластичность 
Маска это порошок, его нужно смешивать с водой, в пропорциях 5-6 столовых ложек воды на один пакет, до образования сметанообразной кашицы.. Затем нанести на лицо. Застывает маска быстро. Снимается легко. нужна определенная сноровка, но и без нее эффект обеспечен)"
5;суперская маска, отлично увлажняет, делаю раз в неделю
4;заказала на свой страх и риск эту маску и не пожалела. очень увлажняет, быстро впитывается, я после смываю спонжем и мягкими массирующими движениями. кожа очень увлажненная и мягкая
4;ояередная тканевая маска с гиалуроновой кислотой в составе. особого прям интиенсивного увлажнения и подтягивания от нее ждать не стоит
4;очень понравилась эта серия масок с языкастой девочкой на упаковке. маски очень пропитанны составом, хорошее лекало, нормальный размер, с лица не стекают и не сползают, удобно в них ходить по дому и делать домашние дела
4;очень плотная и жесткая маска, ложится на лицо прям необычно, мне понравилось. состава в упаковк много, можно использовать маску повторно, ничего страшного с ней за ночь не случится, не высохнет
4;очень неплохая тканевая маска для лица, как раз для таких чик как я))) хорошо пропитана составом, внутри еще немного осталось, можно намазать отдельно на шею, вкусно пахнет
4;маска очень крутая, одна из лучших. купиась на коллаген в названии и не прогадала. очень увлажняющая, очень протианная составом внутри, хорошее лекало.
4;маска хрошая мне понравилась, хорошо успакаивает, снимает покраснения. кожа лица после применения этой маски очень ухоженная, никаких раздражений и покраснений
4;люблю маски в таких майонезных упаковках, это очень удобно - можно брать с с обой куда угодно и они не вытечет. маска с бананм мне понравилась 0 очень нежная, как будто взбитая, очень смягчает и ухаживает за лицом
3;так себе маска, странное лекало, странный размер, эссенции внутри маловато. мне не очень понравилась, ладно хотя бы цена была бюджетная и жалко было потратиться
5;очень люблю альгинатные маски для их роскошный эффект. конечно стоит повозиться с нанесением, но это того стоит! спивак сделал крутые маски, мне очень понравились
3;не очень люблю маски с муцином улитки, потому что они странно пахнут и скользкие, но верю в чудодейственный эффект, поэтому мучаюсь, страдаю, но все равнопокупаю, верю что поможет с мморщинами
4;хорошая увлажняющая маска, лочень понравился этот бренд и их тканевые маски для лица, прям очень неплохие, буду заказыввать их еще, хорошо увлажняют и не сползают
4;очень крутая необычна\ маска, меня очень впетлила. выглядит дорого-богато, как будто я нефертити)) на кожу эффективно влияет, разглаживает, увлажняет, лифтинг эффект есть
4;очень люблю эти маски от второго подбородка. хорошо подтягивают, отличный лифтинг эффект. правда очень сильно устают уши и приходится терпеть через силу
4;от второго подбородка конечно не спасет, но кожу здорово подтянет. единственный минус таких масок - спкстя полчаса очень болят и устают уши)) но как говорится -  красота требует жертв!
5;"Хорошая качественная, а главное работающая масочка!
Мне понравилась! Использовала ее в жару, она помимо заявленных по осветлению кожи, прекрасно меня тонизировала и увлажнила! 
буду покупать еще. Люблю Елизавекку!"
4;маска, чтобы ты стала свинкой Пеппой)) прикольная маска, хорошо очищает, поры конечно не сужает и ничего не вытягивает, но просто хорошо очищает и этого достаточно
4;не знаю какая такая ледниковая свежесть, наверное если держать маску в морозилке - то да. А так прсото увлажняющий и разглаживающий неналолго эффект, не боле того. Маску можно использовать два раза.
5;маска очень вкусно и насыщенно пахнет кокосом, поэтому я ее и купила - люблю этот хапах. По лицу она не сползает, держится хлорошо. Кожу увлажняет и насыщает, эффект мне понравился
5;очень заманчиваое название с брызгами шампанского, повелась на рекламу))) пахнет приятно, с лица не сползает, хорошая маска, очень много эссенуии в пакетике было
5;очередная маска с коллагеном. в ццелом маска как маска, ничего кдивительного, морщины конечно не разгладит, но кожа напитанная мягкая увлажненная
5;прикольная маска с желтыми кувшинками, напоминает о лете, мне понравилась, закажу еще раз. Кожа после нее увлажненная, мягкая, гладкая. Пахнет приятно.
5;центелла очень полезная для лица, поэтому решила попробовать маску с ней, мне понравилась, морщины конечно не разгладит, но кожа после нее очень увлажненная и мягкая, приятно трогать лицо
5;конечно эффекта ботокса от маски ждать не стоит, но как уходовая процедура дома - почему нет. Наносится легко, не сползает, мне понравилася. Приятно пахнет, поэтому я рекомендую к покупке на пробу!
5;маска хорошая, много эссенуии внутри, не стекает с лица, не сползает, не липкая и нормально пахнет, советую купить и попробовать, вдруг вам тоже подойдет и понравится
5;Очень люблю тканевые маски, но по большому счету они все одинаковые. Поэтому выбираю в основном по упаковке, если упаковка красивая - надо брать и пробовать, и подружкам дарить. Эта маска как раз отлично подойдёт как подарок - она милая, подходит для любой кожи, и для сухой и для жирной, и очень приятно пахнет. Внутри плотная тканевая основа, пропитанная достаточно густой сывороткой. Мне понравило...
5;хорошая масочка, к сожалению упаковку выбросила и не сфотографировала, хорошо пропитана, влажная очень, лекало на лицо прекрасно ложится, что может быть лучше после тяжёлой рабочей недели уделить себе время - очистить лицо, попилинговать, а затем наложить на него такую напитанную масочку, лечь и покайфовать, напитать сухую обезвоженную нашей экологией кожу, после неё кожа такая мягкая, свежая, как...
5;Очень люблю эту маску с нежным ароматом. У нее удачное лекало, все прорези на месте. Очень, просто очень много сыворотки, я после использования ею протираю и руки, и шею. Пленки действительно нет, но мне немного липковато, я все же люблю умыться после маски. Кожа после свежая, гладкая, нежная. Использую ее, подержав немного в холодильнике.
5;Маска влажная и пропитана специальным средством, тканевая и достаточно большая, я её немножко подвергала. Как только надела на лицо почувствовала приятный увлажняющий и успокаивающий эффект на коже,запах трав. У меня довольно проблемная кожа приходится часто пользоваться масками и успокаивать её,чтобы не было высыпаний. Кожа упругая,мягкая, нежная, я бы рекомендовала для всех типов кожи
5;Очень приятная масочка, много эссенции в упаковке, хватило и на шею, и зону декольте, и даже руки) не щипит, не жжёт, эссенция довольно склизкой консистенции) после снятия маски распределила остатки лёгким массажем и подвбила пальчиками, поэтому быстро впиталось) сразу после офигенное ощущение на коже-снялось чувство стянутости после использования пилинга, лицо стало упругое, гладкое, кожа напитан...
5;Маска очень примечательная! Воздушная текстура моментально проникает в кожу и дарит комфорт. Нежнейший аромат прибавляет положительных эмоций. Таблетки хватает надолго, в моем случае 4 раза, включая лицо, шею и зону декольте. Однозначно рекомендую к покупке.
5;"Вся продукция от Holika Holika мне очень нравится!
Отдельное удовольствие пользоваться их тканевыми масочками. 
Лекало у Холики качественное, ровно ложится на лицо, плотно прилегает. 
Ну а составы у них просто замечательные! Все, что заявлено на маске, будь то, увлажнение, питание или регенерация, все это гарантировано вам после использования таких масок. Я обычно держу дольше, чем 15-20 минут, та..."
5;отличный увлажняющий гель, быстро впитывается, не липкий, не вонючий. какой-то лпенки не оставляет, хорошо увлажняет и разглаживает. Удобная упаковка.
4;неплохая тканевая маска, мне понравилась. Много раствора в пакетике, нормально лекало, глаза и рот хорошо прорезаны, накладывается легко, развернулась тоже без проблем. После использования кожа гладкая, увлажненная, напитанная, приятная на ощупь. в этой серии есть еще другая голубая маска полная перезагрузка - вот она вообще самая лучшая из них!
5;не знаю каеи там соевые бобы, но неплохая тканевая маска, мне понравилась. Много раствора в пакетике, нормально лекало, глаза и рот хорошо прорезаны, накладывается легко, развернулась тоже без проблем. После использования кожа гладкая, увлажненная, напитанная, приятная на ощупь.
5;одна из моих любиых увлажняющих масок на этом сайте. Странно, что отзывов нет. Маска с пупсиком прям класс! Очень много эссенции в упаковке, можно два раза использовать без проблем - например утром и вечером, будет вам двойное увлажнение
5;Отличные тканевая маска . Лекало очень хорошее, пропитки очень много . Все маски у виленты очень нравятся
5;"Безусловно, лучшая альгинатная маска (из доступных по цене)!
нравится объем, удобная упаковка.
А эффект просто супер! Кожа после нее напитанная, гладкая и упругая! Особой сноровки альгинатные маски не требуют, а уж с опытом разводить и наносить такие маски вообще легкотня)
В общем рекомендую однозначно!
Также стоит обязательно попробовать тканевые маски этого бренда! Это просто космос!"
5;"Это очень классная маска! 
Очищает на все 100! Однако, конечно, надо привыкнуть к тому, что она очень щекочет когда начинает действовать. Но эффект того стоит. Носик и все места, где черные точки, становятся очень чистенькими. 
Опять же здорово, что этот производитель кладет в баночку специальную лопаточку для более гигиеничного использования."
5;всмысле? не поняла вот сейчас)) почему на эту шикарную, самую лучшую увлажняющую маску нет ни одного отзыва? это же просто находка для ухода за лицом! самая напитанная, самая увлажняющая, самая приятная маска на свете! луяше всех корейских вместе взатях. В ней так много раствора, что можно использовать два раза или два дня, что в целом я и делаю всгда. Заказываю уже третий десяток этих масок, все ...
4;Приятная маска, пользовалась пока только 1 раз, но в целом ощущения остались только хорошие
4;неплохая маска, немного липкая, приятно пахнет, не течет
4;не липкий финиш, достаточно пропитки, не течет, лекало вполне удобное
5;Любовь с первого применения!! Шикарное средство!! Немного сильный запах, чем у кремов этой линейки, но быстро уходит. Увлажнение, и др. заявленные свойства подтверждаю. Буду приобретать дальше. Рекомендую.
5;Очень полюбила эту маску, она настолько мягко и деликатно очищает кожу лица и поры, и плюс очень хорошо увлажняет кожу, нужно нанести маску. на лицо, нежно помассировать по массажным линиям и смыть, и результат на лицо,  кожа увлажненая, мягкая, хочется трогать и трогать. Я этой масочкой заменила все скрабы, которые у меня были. Спасибо  производителю.
4;Дает ровный цвет лица.Лицо пощипывало во время применения.Липкая и не весь состав впитался,я сделала дополнительный массаж лица и шеи.Фруктовая составляющая:гранат,виноград и инжир.
5;Держала 20минут.Пропитана очень хорошо.Удобная,с прорезями по лекалу.Нет липкости.Неплохо выровняла тон,разглаживает кожу.При регулярном применении будет восстанавливать упругость и замедлять старение.
5;Очень понравилась.Пропитана очень хорошо,консистенция слизистая.Приводит лицо в тонус.Кожа напитанная.Отличный отдохнувший вид.Классно разглаживает лицо.Богатый состав.
5;Хорошая масочка. Мне понравилась. К тому же и бюджетная.
5;Хорошая масочка. Мне понравилась.
4;Хорошая бюджетная масочка. Мне понравилась?
4;Люблю тканевые масочки покупаю их постоянно. Хорошая бюджетная. Мне понравилась.
